id,title,company,location,category,salary_min,salary_max,created,description,redirect_url
5731966518,Big Data Developer (Hadoop and Scala),Allime Tech Solutions,"Chennai, Tamil Nadu",IT Jobs,,,2026-05-17T06:49:59Z,"Design, develop, and maintain big data solutions to meet business requirements and support data-driven decision making. Work with stakeholders to understand their data needs and determine how to best use big data technologies to meet those needs. Design and implement scalable, high-performance big data architectures, using technologies such as Hadoop, Spark, and NoSQL databases. Extract, transform, and load large data sets into a big data platform for analysis and reporting. Write complex SQL q…",https://www.adzuna.in/details/5731966518?utm_medium=api&utm_source=7cd92d92
5788791734,Data & Business Insights Sr. Associate,"NTT America, Inc.","Chennai, Tamil Nadu",IT Jobs,,,2026-07-05T10:44:06Z,"Work On Analytics, Reporting and Business Intelligence Projects Accountabilities Understand, Gathering and Prepare the requirements for Business. Works under supervision with internal and external teams to understand customer requirements Ability to elaborate on the details of a project Collaborate with Automation Engineers, Machine Learning Engineers, Data Analysts and Business Intelligence Analyst to execute deliverables. Must possess technical writing, decision making, and problem-solving sk…",https://www.adzuna.in/details/5788791734?utm_medium=api&utm_source=7cd92d92
5766336378,Senior Analyst Data Governance and Quality- Assistant Vice President,Citigroup,"Chennai, Tamil Nadu",IT Jobs,,,2026-06-17T10:26:34Z,"Job Details We value our talented employees, and whenever possible strive to help one of our associates grow professionally before recruiting new talent to our open positions. If you think the open position you see is right for you, we encourage you to apply! Our people make all the difference in our success.  About us: Analytics Information management (AIM) is a global community that is driving data driven transformation across Citi in multiple functions with the objective to create actionable…",https://www.adzuna.in/details/5766336378?utm_medium=api&utm_source=7cd92d92
4596884513,Data Engineer,The Hub,"Chennai, Tamil Nadu",IT Jobs,100000.0,1500000.0,2024-03-07T15:29:34Z,"5-7 years of experience in Data Engineering with solid experience in design, development and implementation of end-to-end data ingestion and data processing system in AWS platform. 2-3 years of experience in AWS Glue, Lambda, Appflow, EventBridge, Python, PySpark, Lake House, S3, Redshift, Postgres, API Gateway, CloudFormation, Kinesis, Athena, KMS, IAM. Experience in modern data architecture, Lake House, Enterprise Data Lake, Data Warehouse, API interfaces, solution patterns, standards and opt…",https://www.adzuna.in/details/4596884513?utm_medium=api&utm_source=7cd92d92
5786033252,Lead Engineer – Data Engineering,CBTS India,"Chennai, Tamil Nadu",IT Jobs,,,2026-07-03T03:01:12Z,"LEAD ENGINEER – DATA ENGINEERING JOB TITLE: Lead Engineer – Data Engineering 1. Role Purpose (1–3 lines): Design, build, and optimize large-scale data pipelines and integration frameworks that support analytics, reporting, and AI/ML workloads. This role ensures high data availability, quality, and performance across enterprise systems. 2. Key Responsibilities: • Develop, maintain, and enhance scalable data ingestion, transformation, and storage pipelines. • Ensure data integrity, reliability, a…",https://www.adzuna.in/details/5786033252?utm_medium=api&utm_source=7cd92d92
5776798500,"Analyst II, Data Science (R-19484)",Dun & Bradstreet,"Chennai, Tamil Nadu",Accounting & Finance Jobs,,,2026-06-26T02:39:45Z,"Shape the Future with Dun & Bradstreet At Dun & Bradstreet, we believe data has the power to create a better tomorrow. As a global leader in business decisioning data and analytics, we help companies worldwide grow, manage risk, and innovate. For over 180 years, businesses have trusted us to turn uncertainty into opportunity. We’re a diverse, global team that values creativity, collaboration, and bold ideas. Are you ready to make an impact and help shape what’s next? Join us! Explore opportunit…",https://www.adzuna.in/details/5776798500?utm_medium=api&utm_source=7cd92d92
5781967107,"Workflow Analyst , Ring Data Engineering Services",ADCI MAA 12 SEZ,"Chennai, Tamil Nadu",Admin Jobs,,,2026-06-30T14:57:03Z,"The Workflow Analyst oversees end-to-end tactical planning for Operations, driving tactical preparedness in planning the right people, at the right times, with the right skills, to ensure world-class service delivery to customers. This employee has an analytical mindset and workforce management experience, using these to create actionable and data-driven action plans for local and global stakeholders to support operational partners. Key job responsibilities The role delivers weekly analytical i…",https://www.adzuna.in/details/5781967107?utm_medium=api&utm_source=7cd92d92
5781967106,"Business Analyst, Ring Data Engineering Services",ADCI MAA 12 SEZ,"Chennai, Tamil Nadu",IT Jobs,,,2026-06-30T14:57:03Z,"The Business Analyst role family focuses on using data analysis and business knowledge to solve problems and drive decisions. Key job responsibilities You use data and your understanding of business objectives to solve straightforward problems to drive decision(s) and action(s) within a workflow. You analyze straightforward or previously-defined business and/or data processes to drive improvement. Your work is tactical, where you take actions to achieve a defined goal. Those actions require you…",https://www.adzuna.in/details/5781967106?utm_medium=api&utm_source=7cd92d92
2742136167,Senior Data Scientist,Ganit Business Solutions,"Chennai, Tamil Nadu",IT Jobs,1500000.0,1800000.0,2021-12-16T05:52:42Z,"What you will be doing- Understand business problems and translate business requirements into technical requirements. Conduct complex data analysis to ensure data quality & reliability i.e., make the data talk by extracting, preparing, and transforming it. Identify, develop and implement statistical techniques and algorithms to address business challenges and add value to the organization. Gather requirements and communicate findings in the form of a meaningful story with the stakeholders. Buil…",https://www.adzuna.in/details/2742136167?utm_medium=api&utm_source=7cd92d92
3949357015,Informatica Cloud-IICS,People First Consultants,"Chennai, Tamil Nadu",IT Jobs,600000.0,1000000.0,2023-03-01T01:41:55Z,"Designation: Informatica cloud(IICS) Experience: 6-9 Years Location: Pan India Job Description Must have: Work experience in Informatica Intelligent Cloud Services and SQL, Data analyst. Roles and responsibilities Tracking/management of all software assets to include internal license assessments Participate in software vendor contract/license negotiations and the development of software licenses and associated maintenance contracts. Knowledge in SW license procurement & hands on experience in A…",https://www.adzuna.in/details/3949357015?utm_medium=api&utm_source=7cd92d92
5564531660,Team Lead Data Engineer,Mindera,"Kasturibai Nagar, Chennai",IT Jobs,,,2026-01-02T17:10:52Z,"We are seeking a highly skilled and proactive Data Engineer to join our team. The ideal candidate will have strong hands-on expertise with AWS cloud services , Databricks , Apache Spark , Python , and SQL , along with excellent communication and stakeholder engagement skills. You will play a key role in designing, building, and optimizing data pipelines and analytics solutions that support critical business initiatives. Key Responsibilities Design, develop, and maintain scalable data pipelines …",https://www.adzuna.in/details/5564531660?utm_medium=api&utm_source=7cd92d92
4801573851,Data Product Manager | Offshore,Photon Group,"Chennai, Tamil Nadu",IT Jobs,,,2024-07-31T03:16:16Z,"Description Data Product Manager Job Description: As the Data Product Manager, you will create and enhance data offerings that align to the product vision. You are a team player with a passion for delivering data solutions that help our customers succeed. This role requires you to analyse complex problems and collaborate with our data science and engineering teams to execute the product roadmap. Qualifications: Prioritize and execute the data strategy roadmap to provide value to our customers. …",https://www.adzuna.in/details/4801573851?utm_medium=api&utm_source=7cd92d92
3949357047,Data analytics-Internal audit,People First Consultants,"Chennai, Tamil Nadu",Accounting & Finance Jobs,100000.0,1200000.0,2023-03-01T01:41:56Z,"JOB SUMMARY: The Senior Associate supports the Data Analytics Manager by proposing relevant analytics procedures/tools, executing the analytics and also developing visualization outputs for audits, continuous monitoring/auditing and IA initiatives. The individual’s responsibilities include - Understanding audit and/or project objectives and assisting the manager in preparing the plan and timelines. Working with the Process/BU/IA teams for gathering requirements for continuous monitoring/auditin…",https://www.adzuna.in/details/3949357047?utm_medium=api&utm_source=7cd92d92
5777256359,Data Specialist,YipitData,"Chennai, Tamil Nadu",Scientific & QA Jobs,,,2026-06-26T10:34:31Z,"About YipitData: YipitData is the leading market research and analytics firm for the disruptive economy and recently raised up to $475M from The Carlyle Group at a valuation over $1B. We analyze billions of alternative data points every day to provide accurate, detailed insights on ridesharing, e-commerce marketplaces, payments, and more. Our on-demand insights team uses proprietary technology to identify, license, clean, and analyze the data many of the worlds largest investment funds and corp…",https://www.adzuna.in/details/5777256359?utm_medium=api&utm_source=7cd92d92
3546811670,Data Engineer,Agiletech Info Solutions pvt ltd,"Chennai, Tamil Nadu",IT Jobs,400000.0,1500000.0,2022-10-02T07:01:19Z,"We are looking for a Data Engineer to join our growing team of analytics experts. The hire will be responsible for expanding and optimizing our data and data pipeline architecture, as well as optimizing data flow and collection for cross functional teams. The ideal candidate is an experienced data pipeline builder and data wrangler who enjoy optimizing data systems and building them from the ground up. The Data Engineer will support our software developers, database architects, data analysts an…",https://www.adzuna.in/details/3546811670?utm_medium=api&utm_source=7cd92d92
5743026953,Lead Data Quality and Governance Analyst - Vice President,Citigroup,"Chennai, Tamil Nadu",IT Jobs,,,2026-05-28T10:19:24Z,About us: Analytics Information management (AIM) is a global community that is driving data driven transformation across Citi in multiple functions with the objective to create actionable intelligence for our business leaders. We are a fast-growing organization working with Citi businesses and functions across the world. What do we offer: USCC Enterprise Data team manages the implementation of best-in-class data quality measurement programs across globe in retail consumer bank. The critical are…,https://www.adzuna.in/details/5743026953?utm_medium=api&utm_source=7cd92d92
5665633763,Senior Executive - FinOps,Hapag-Lloyd,"Chennai, Tamil Nadu",IT Jobs,,,2026-03-15T01:39:30Z,"Description FinOps & Data Analyst will be responsible for reporting financial metadata of Cloud (AWS, Azure, SaaS) and Onprem (Mainframe, Midrange) environments to create run cost visibility across Hapag-Lloyd AG. This role combines FinOps FOCUS practices (forecasting, budgeting, unit economics) with strong data engineering and analytical skills (ETL, dashboards, Python automation) to deliver actionable insights and financial governance. This collected metadata will be used by leadership for fo…",https://www.adzuna.in/details/5665633763?utm_medium=api&utm_source=7cd92d92
4237645418,Data Engineer,SangatHR,"Chennai, Tamil Nadu",IT Jobs,1000000.0,1500000.0,2023-08-02T13:15:44Z,"Analytics Job Description We are hiring an Analytics Engineer to help drive our Business Intelligence efforts. You will partner closely with leaders across the organization, working together to understand the how and why of people, team and company challenges, workflows and culture. The team is responsible for delivering data and insights that drive decision-making, execution, and investments for our product initiatives. You will work cross-functionally with product, marketing, sales, engineeri…",https://www.adzuna.in/details/4237645418?utm_medium=api&utm_source=7cd92d92
5438278422,"Lead Analyst, AI Engineer(Data Science)",Peak Hire Solutions,"Chennai, Tamil Nadu",IT Jobs,2000000.0,4800000.0,2025-10-09T06:47:12Z,"JOB DESCRIPTION/PREFERRED QUALIFICATIONS: REQUIRED SKILLS/COMPETENCIES: Programming Languages: Strong in Python, data structures, and algorithms. Hands-on with NumPy, Pandas, Scikit-learn for ML prototyping. Machine Learning Frameworks: Understanding of supervised/unsupervised learning, regularization, feature engineering, model selection, cross-validation, ensemble methods (XGBoost, LightGBM). Deep Learning Techniques: Proficiency with PyTorch or TensorFlow/Keras Knowledge of CNNs, RNNs, LSTMs…",https://www.adzuna.in/details/5438278422?utm_medium=api&utm_source=7cd92d92
5473694134,"Lead Analyst, AI Engineer (Data Science)",Peak Hire Solutions,"Chennai, Tamil Nadu",IT Jobs,4000000.0,4800000.0,2025-11-01T06:49:00Z, Ideal Candidate Profile: This role requires a seasoned engineer/scientist with a strong academic background from a premier institution and significant hands-on experience in deep learning (specifically image processing) within a hardware or product manufacturing environment.  Must-Have Requirements: Experience & Education Combinations: Candidates must meet one of the following criteria: Doctorate (PhD)  2 years of related work experience Master's Degree  5 years of related work experience Bach…,https://www.adzuna.in/details/5473694134?utm_medium=api&utm_source=7cd92d92
2406639454,Data Scientist,Ganit Business Solutions,"Chennai, Tamil Nadu",IT Jobs,600000.0,2000000.0,2021-08-25T23:06:44Z,"Ganit Inc. is the fastest growing Data Science & AI company in Chennai. Founded in 2017, by 3 industry experts who are alumnus of IITs/SPJIMR with each of them having 17 years of experience in the field of analytics. We are in the business of maximising Decision Making Power (DMP) for companies by providing solutions at the intersection of hypothesis based analytics, discovery based AI and IoT. Our solutions are a combination of customised services and functional product suite. We primarily ope…",https://www.adzuna.in/details/2406639454?utm_medium=api&utm_source=7cd92d92
4596884483,Data Engineer,The Hub,"Chennai, Tamil Nadu",IT Jobs,100000.0,1500000.0,2024-03-07T15:29:34Z,"Position Overview: We are seeking a talented Data Engineer with expertise in Power BI to join our team. The ideal candidate will be responsible for designing and implementing data pipelines, as well as developing insightful visualizations and reports using Power BI. Additionally, the candidate should have strong skills in Python, data analytics, PySpark, and Databricks. This role requires a blend of technical expertise, analytical thinking, and effective communication skills. Key Responsibiliti…",https://www.adzuna.in/details/4596884483?utm_medium=api&utm_source=7cd92d92
5695230436,Clinical Business Analyst,People First Consultants,"Chennai, Tamil Nadu",IT Jobs,,,2026-04-10T08:49:08Z,"OB DESCRIPTION Job Title: Business Analyst (Clinical) Position Overview: The EMR Business Analyst plays a critical role in bridging the gap between healthcare operations and technology solutions. This position is responsible for analyzing, documenting, and managing business processes related to Electronic Medical Records (EMR) systems. The EMR BA collaborates with stakeholders, including healthcare providers, IT professionals, and administrative staff, to ensure the effective implementation and…",https://www.adzuna.in/details/5695230436?utm_medium=api&utm_source=7cd92d92
5726293714,Power BI Developer (Mid-Level),Infosys,"Chennai, Tamil Nadu",IT Jobs,,,2026-05-12T05:45:44Z,"Job Description Educational Requirements Bachelor Of Technology,Bachelor of Engineering Service Line Enterprise Package Application Services Responsibilities A day in the life of an Infoscion As part of the Infosys consulting team, your primary role would be to get to the heart of customer issues, diagnose problem areas, design innovative solutions and facilitate deployment resulting in client delight. You will develop a proposal by owning parts of the proposal document and by giving inputs in …",https://www.adzuna.in/details/5726293714?utm_medium=api&utm_source=7cd92d92
5497208935,Senior IBM DataStage Developer,UPS,"Chennai, Tamil Nadu",IT Jobs,,,2025-11-15T11:59:00Z,"Before you apply to a job, select your language preference from the options available at the top right of this page. Explore your next opportunity at a Fortune Global 500 organization. Envision innovative possibilities, experience our rewarding culture, and work with talented teams that help you become better every day. We know what it takes to lead UPS into tomorrow-people with a unique combination of skill  passion. If you have the qualities and drive to lead yourself or teams, there are role…",https://www.adzuna.in/details/5497208935?utm_medium=api&utm_source=7cd92d92
5764691467,GBS HR Business partner,Insight Advisors Private Limited,"Egmore Nungambakkam, Chennai",HR & Recruitment Jobs,,,2026-06-16T03:00:49Z,"Job Description – GBS HR Business Partner Location: Chennai (GBS Center) Employment Type: Full-Time Role Type: People Manager Experience: 10–15 Years (Candidates with higher relevant experience may also be considered) Role Overview We are seeking an experienced GBS HR Business Partner to support and enable our Global Business Services (GBS) organization. This role combines strategic HR partnership with leadership of HR service delivery initiatives to ensure scalable, compliant, employee-centric…",https://www.adzuna.in/details/5764691467?utm_medium=api&utm_source=7cd92d92
4829260186,Senior Data engineer,Pluginlive,"Chennai, Tamil Nadu",IT Jobs,1000000.0,3000000.0,2024-08-17T11:14:22Z,"Company: PluginLive About the company: PluginLive Technology Pvt Ltd is a leading provider of innovative HR solutions. Our mission is to transform the hiring process through technology and make it easier for organizations to find, attract, and hire top talent. We are looking for a passionate and experienced Data Engineering Lead to guide the data strategy and engineering efforts for our Campus Hiring Digital Recruitment SaaS Platform. Role Overview: The Data Engineering Lead will be responsible…",https://www.adzuna.in/details/4829260186?utm_medium=api&utm_source=7cd92d92
1583299519,Data Engineer,Mobile Programming LLC,"Chennai, Tamil Nadu",IT Jobs,1200000.0,1800000.0,2020-06-24T23:29:10Z,"Position: Data Engineer Location: Chennai- Guindy Industrial Estate Duration: Full time role Company: Mobile Programming ( https://www. mobileprogramming.com/ ) Client Name: Samsung We are looking for a Data Engineer to join our growing team of analytics experts. The hire will be responsible for expanding and optimizing our data and data pipeline architecture, as well as optimizing data flow and collection for cross functional teams. The ideal candidate is an experienced data pipeline builder a…",https://www.adzuna.in/details/1583299519?utm_medium=api&utm_source=7cd92d92
5497208936,Senior IBM DataStage Developer,UPS,"Chennai, Tamil Nadu",IT Jobs,,,2025-11-15T11:59:00Z,"Avant de postuler à un emploi, sélectionnez votre langue de préférence parmi les options disponibles en haut à droite de cette page. Découvrez votre prochaine opportunité au sein d'une organisation qui compte parmi les 500 plus importantes entreprises mondiales. Envisagez des opportunités innovantes, découvrez notre culture enrichissante et travaillez avec des équipes talentueuses qui vous poussent à vous développer chaque jour. Nous savons ce qu'il faut faire pour diriger UPS vers l'avenir : d…",https://www.adzuna.in/details/5497208936?utm_medium=api&utm_source=7cd92d92
5718936505,Data Quality Engineer,Papigen,"Chennai, Tamil Nadu",IT Jobs,1000000.0,1500000.0,2026-05-05T05:54:25Z,"Role Summary We are looking for a Data Quality Engineer to ensure data accuracy, consistency, and reliability across enterprise data platforms. The role involves working with large datasets, building and validating data pipelines , and implementing data quality frameworks within a modern cloud ecosystem using Microsoft Azure and Databricks. Key Responsibilities Data Quality & Validation Design and implement data quality checks, validation rules, and monitoring frameworks . Ensure data accuracy,…",https://www.adzuna.in/details/5718936505?utm_medium=api&utm_source=7cd92d92
2706556693,Data Scientist,Ganit Business Solutions,"Chennai, Tamil Nadu",IT Jobs,1200000.0,2500000.0,2021-12-04T02:41:04Z,"Ganit has flipped the data science value chain as we do not start with a technique but for us, consumption comes first. With this philosophy, we have successfully scaled from being a small start-up to a 200 resource company with clients in the US, Singapore, Africa, UAE, and India. We are looking for experienced data enthusiasts who can make the data talk to them. You will: Understand business problems and translate business requirements into technical requirements. Conduct complex data analysi…",https://www.adzuna.in/details/2706556693?utm_medium=api&utm_source=7cd92d92
5762872110,GCP Data Engineer,Capco,"Chennai, Tamil Nadu",IT Jobs,,,2026-06-14T02:28:28Z,"About Us “Capco, a Wipro company, is a global technology and management consulting firm. Awarded with Consultancy of the year in the British Bank Award and has been ranked Top 100 Best Companies for Women in India 2022 by Avtar & Seramount. With our presence across 32 cities across globe, we support 100 clients across banking, financial and Energy sectors. We are recognized for our deep transformation execution and delivery. WHY JOIN CAPCO? You will work on engaging projects with the largest in…",https://www.adzuna.in/details/5762872110?utm_medium=api&utm_source=7cd92d92
5785770903,GCP Data Engineer,Capco,"Chennai, Tamil Nadu",IT Jobs,,,2026-07-03T00:54:12Z,"This job is with Capco, an inclusive employer and a member of myGwork – the largest global platform for the LGBTQ business community. Please do not contact the recruiter directly. About Us “Capco, a Wipro company, is a global technology and management consulting firm. Awarded with Consultancy of the year in the British Bank Award and has been ranked Top 100 Best Companies for Women in India 2022 by Avtar & Seramount. With our presence across 32 cities across globe, we support 100 clients across…",https://www.adzuna.in/details/5785770903?utm_medium=api&utm_source=7cd92d92
5731966517,"Python, Pyspark, SQL Developer",Allime Tech Solutions,"Chennai, Tamil Nadu",IT Jobs,,,2026-05-17T06:49:59Z,"Key Responsibilities: Design, develop, and maintain ETL pipelines using Python , PySpark , and SQL on distributed data platforms. Write clean, efficient, and scalable PySpark code for big data transformation and processing. Develop reusable scripts and tools for data ingestion , cleansing , validation , and aggregation . Work with structured and semi-structured data (JSON, Parquet, Avro, etc.). Optimize SQL queries for performance and cost-efficiency in data lakes or warehouses. Collaborate wit…",https://www.adzuna.in/details/5731966517?utm_medium=api&utm_source=7cd92d92
5453621864,3930937-Senior Manager,EXL,"Chennai, Tamil Nadu",IT Jobs,,,2025-10-18T14:59:30Z,"Description JD (Job Description) for Solutions Architect for Provider 360 – C2 role About EXL Health Payments Analytics: At EXL Health Payments Analytics Center of Excellence, we are looking for passionate individuals with growth/startup mindset to experiment, fail fast, learn and contribute to our 5 fold growth story of $200M to $1B EXL is considered Special investigation Unit by 6 of top 10 US health insurance companies (~1/3rd US healthcare data is handled by us) helping with error/overpayme…",https://www.adzuna.in/details/5453621864?utm_medium=api&utm_source=7cd92d92
3262155285,Full Stack Developer,Klenty,"Chennai, Tamil Nadu",IT Jobs,200000.0,800000.0,2022-06-26T06:20:49Z,"Full Stack Developer Job Description: Knowledge in MERN Stack is mandatory Work with development teams and product managers to ideate software solutions Design client-side and server-side architecture Conduct Testing & Debugging, utilize script tools & write basic codes for design specifications Build the front-end of applications through appealing visual design Develop and manage well-functioning databases and applications Write effective APIs Troubleshoot, debug and upgrade software Create se…",https://www.adzuna.in/details/3262155285?utm_medium=api&utm_source=7cd92d92
3183166621,MERN Stack Developer,Klenty,"Chennai, Tamil Nadu",IT Jobs,400000.0,1000000.0,2022-05-31T06:11:50Z,"Full Stack Developer Job Description: Knowledge in MERN Stack is mandatory Work with development teams and product managers to ideate software solutions Design client-side and server-side architecture Conduct Testing & Debugging, utilize script tools & write basic codes for design specifications Build the front-end of applications through appealing visual design Develop and manage well-functioning databases and applications Write effective APIs Troubleshoot, debug and upgrade software Create se…",https://www.adzuna.in/details/3183166621?utm_medium=api&utm_source=7cd92d92
