id,title,company,location,category,salary_min,salary_max,created,description,redirect_url
5784372688,Associate Data Engineer,Amgen,"Hyderabad, Telangana",IT Jobs,,,2026-07-02T02:53:57Z,"Career Category Information Systems Job Description ABOUT AMGEN Amgen harnesses the best of biology and technology to fight the world’s toughest diseases, and make people’s lives easier, fuller and longer. We discover, develop, manufacture and deliver innovative medicines to help millions of patients. Amgen helped establish the biotechnology industry more than 40 years ago and remains on the cutting-edge of innovation, using technology and human genetic data to push beyond what’s known today. A…",https://www.adzuna.in/details/5784372688?utm_medium=api&utm_source=7cd92d92
5784691429,Data Engineer Snowflake DBT,DIGITALCUBE CONSULTANCY SERVICES PRIVATE LIMITED,"Hyderabad, Telangana",IT Jobs,,,2026-07-02T06:24:30Z,Data Engineer Snowflake DBT Location Hyderabad Department Information Technology Employment Type Full Time Experience 3 to 5 years Work Model 5 days work from office relocation not open About Us We are a technology consulting organization that helps companies become intelligent informationdriven businesses where factbased decisionmaking is embedded into daily operations We combine strategic consulting with growthenabling technologies to evaluate risk manage data and leverage AI and automation m…,https://www.adzuna.in/details/5784691429?utm_medium=api&utm_source=7cd92d92
5712129639,Database Administrator,Accenture,"Hyderabad, Telangana",IT Jobs,,,2026-04-28T05:39:31Z,"Job Description Project Role : Database Administrator Project Role Description : Design, implement and maintain databases. Install database management systems (DMBS). Develop procedures for day-to-day maintenance and problem resolution. Must have skills : Databricks Unified Data Analytics Platform Good to have skills : NA Minimum 5 year(s) of experience is required Educational Qualification : 15 years full time educationJob Summary Data Analyst plays a critical role in supporting Membership Adm…",https://www.adzuna.in/details/5712129639?utm_medium=api&utm_source=7cd92d92
5720979720,Lead Analyst - SQL & Reporting Developer,CGI,"Hyderabad, Telangana",IT Jobs,,,2026-05-07T05:50:32Z,"Job Description We are seeking an experienced Senior SQL & Reporting Developer with strong expertise in SQL Server, SSRS, SSAS, and Reporting solutions. The ideal candidate will have hands-on experience in building database tables, managing data flows, and developing enterprise-level reporting solutions. Strong domain knowledge in Retail Banking, Lending, and Depository services is mandatory, along with excellent communication and stakeholder management skills. Your future duties and responsibi…",https://www.adzuna.in/details/5720979720?utm_medium=api&utm_source=7cd92d92
5726483971,"Sr. Associate, Content Ops Analytics",Amgen,"Hyderabad, Telangana",IT Jobs,,,2026-05-12T09:58:21Z,"Position Overview The Senior Associate, Content Data Analyst is responsible for supporting global content strategy by delivering scalable analytics, standardized metrics, and actionable insights across the content ecosystem. This role operates at a global level, partnering with U.S. and international stakeholders to define, measure, and optimize content performance. The analyst will drive reporting frameworks, develop global dashboards, and enable visibility into key content strategy metrics su…",https://www.adzuna.in/details/5726483971?utm_medium=api&utm_source=7cd92d92
5707958517,Senior Manager - Data Engineering,Inspire Brands Hyderabad Support Center,"Hyderabad, Telangana",IT Jobs,,,2026-04-23T09:45:26Z,"Lead and manage agile teams of Data Engineer, Data Analyst, Architect, Data Engineering Manager, etc. to build, deliver, and support strategic initiatives at scale. Responsible for engineering of Inspires enterprise data platforms, enabling value-driven business use cases and deep analytics. RESPONSIBILITIES: Attract, mentor, guide, coach team members or direct reports. Manage multiple development teams leading technical execution and delivery of new initiatives. Ensure technical solutions are …",https://www.adzuna.in/details/5707958517?utm_medium=api&utm_source=7cd92d92
5067536916,Senior Software Engineer - Data Engineer - Data & ML Engineering,Bristol Myers Squibb,"Hyderabad, Telangana",IT Jobs,,,2025-03-01T03:37:19Z,"BMS Hyderabad is an integrated global hub where our work is focused on helping patients prevail over serious diseases by building sustainable and innovative solutions. This important science, technology, and innovation center will support a range of technology and drug development activities that will help us usher in the next wave of innovation. Position: Senior Software Engineer - Data Engineer - Data & ML Engineering Location : Hyderabad, India At Bristol Myers Squibb, we are inspired by a s…",https://www.adzuna.in/details/5067536916?utm_medium=api&utm_source=7cd92d92
5689084198,"Sr. Associate, Content Ops Analytics",Amgen,"Hyderabad, Telangana",IT Jobs,,,2026-04-04T02:05:13Z,"Career Category Sales & Marketing Operations Job Description Position Overview The Senior Associate, Content Data Analyst supports metadata tagging operations and content ecosystem reporting for Global Content Strategy. This role focuses on internal operations, helping ensure the accuracy, consistency, and performance of metadata tagging while enabling visibility into CCEL (cross channel engagement leads) operational performance through dashboards and reporting. The role requires strong analyti…",https://www.adzuna.in/details/5689084198?utm_medium=api&utm_source=7cd92d92
5774235359,Senior Data Engineer,Warner Bros. Discovery,"Hyderabad, Telangana",IT Jobs,,,2026-06-24T07:22:26Z,"Roles & Responsibilities We are looking for a highly motivated Sr Data Engineer to build a state-of-the-art data platform to solve various data-driven use cases across the organization. This platform will host multiple data products, including but not limited to, Subscription, Content, and Product Analytics, Personalization and Recommendation, Marketing & Ad-Sales enablement. You will be building a solution in the cloud - handles both streaming and batch data processing, capable of solving any …",https://www.adzuna.in/details/5774235359?utm_medium=api&utm_source=7cd92d92
5690404060,"Sr. Associate, Content Ops Analytics",Amgen,"Hyderabad, Telangana",IT Jobs,,,2026-04-05T09:38:07Z,"Position Overview The Senior Associate, Content Data Analyst supports metadata tagging operations and content ecosystem reporting for Global Content Strategy. This role focuses on internal operations, helping ensure the accuracy, consistency, and performance of metadata tagging while enabling visibility into CCEL (cross channel engagement leads) operational performance through dashboards and reporting. The role requires strong analytical skills, hands-on experience with reporting tools, and the…",https://www.adzuna.in/details/5690404060?utm_medium=api&utm_source=7cd92d92
5784728422,Software Engineer,Quanteon Solutions LLP,"Hyderabad, Telangana",IT Jobs,,,2026-07-02T07:18:02Z,"Key Responsibilities: SQL Query Development & Optimization: Design, develop, and maintain complex SQL queries, stored procedures, functions, and views. Optimize existing queries to enhance performance and efficiency when dealing with large datasets. Collaboration with Stakeholders: Work closely with data analysts, developers, and stakeholders to understand business requirements and translate them into robust SQL-based solutions. ETL Process Design & Implementation: Design and implement ETL (Ext…",https://www.adzuna.in/details/5784728422?utm_medium=api&utm_source=7cd92d92
5788468389,Sr Engineer Data Engineering,TransUnion,"Hyderabad, Telangana",IT Jobs,,,2026-07-05T03:37:56Z,"TransUnion's Job Applicant Privacy Notice Team Overview We are seeking a highly experienced and motivated Lead Data Analyst with a strong background in SQL and Spark SQL, Unix shell scripting, supporting ETL setup, Big Data technologies, and AI to lead and mentor a team. You will be responsible for delivery of data. This role requires a deep understanding of data processing, data warehousing, and machine learning principles, along with hands-on experience in cloud environments like AWS and GCP …",https://www.adzuna.in/details/5788468389?utm_medium=api&utm_source=7cd92d92
5768793638,AI Data Engineer,Aditi Tech Consulting Private Limited,"Hyderabad, Telangana",IT Jobs,,,2026-06-19T07:23:47Z,"Summary: The main function of an AI Data Engineer is to construct and maintain data pipelines, ETL processes, and data storage systems to facilitate efficient data collection, processing, and analysis. They ensure data quality and accessibility for data-driven decision-making, collaborating closely with data scientists and analysts. Responsibilities: Drive critical initiatives to help our data platform scale to the needs of business priorities and technology advancements. Build scalable data mo…",https://www.adzuna.in/details/5768793638?utm_medium=api&utm_source=7cd92d92
5768784990,Engineer I,Metlife,"Hyderabad, Telangana",IT Jobs,,,2026-06-19T07:19:34Z,Responsibilities: • Build modern data platform/lake components on cloud. • Analysis and design of data pipelines that bring in various internal and external data into the data lake in the cloud based on the business use case. • Design and development of data marts that make large volumes of data from the data lake accessible to business analysts and data scientists. • Deliver solutions in an agile delivery model. • Implement transformation and data quality rules using modern transformation tool…,https://www.adzuna.in/details/5768784990?utm_medium=api&utm_source=7cd92d92
5465849604,Software Development Test Engineer,Amgen,"Hyderabad, Telangana",IT Jobs,,,2025-10-27T11:06:37Z,"ABOUT AMGEN Amgen harnesses the best of biology and technology to fight the world's toughest diseases, and make people's lives easier, fuller and longer. We discover, develop, manufacture and deliver innovative medicines to help millions of patients. Amgen helped establish the biotechnology industry more than 40 years ago and remains on the cutting-edge of innovation, using technology and human genetic data to push beyond what's known today. ABOUT THE ROLE Role Description: We are seeking a hig…",https://www.adzuna.in/details/5465849604?utm_medium=api&utm_source=7cd92d92
5462323917,Software Development Test Engineer,Amgen,"Hyderabad, Telangana",IT Jobs,,,2025-10-24T15:03:11Z,"Career Category Information Systems Job Description ABOUT AMGEN Amgen harnesses the best of biology and technology to fight the world’s toughest diseases, and make people’s lives easier, fuller and longer. We discover, develop, manufacture and deliver innovative medicines to help millions of patients. Amgen helped establish the biotechnology industry more than 40 years ago and remains on the cutting-edge of innovation, using technology and human genetic data to push beyond what’s known today. A…",https://www.adzuna.in/details/5462323917?utm_medium=api&utm_source=7cd92d92
5732140724,"Risk Analyst (Project Controls, Data Centre Construction)",Linesight,"Baner, Pune",Trade & Construction Jobs,,,2026-05-17T09:57:34Z,"As a Risk Analyst (Project Controls) at Linesight , you will work with highly experienced, culturally diverse, and passionate teams nurturing a strong social dynamic and a shared sense of achievement. You will gain vast industry experience that will open doors for you, extend your skillset and expand your perspective. We will empower, support, and enable you to take real responsibility in your role so that you can take charge of your career progression with us. For us lasting trusted relationsh…",https://www.adzuna.in/details/5732140724?utm_medium=api&utm_source=7cd92d92
5742844383,SQL and Snowflake developer,INNOVA SOLUTIONS,"Hyderabad, Telangana",IT Jobs,,,2026-05-28T06:53:07Z,"Role & responsibilities We are seeking a highly skilled and motivated Data Engineer / SQL Expert with snlowflake to join our dynamic team. In this role, you will design, build, and deploy scalable data solutions to drive insights, improve decision-making, and enhance our products. You will work closely with data scientists, analysts, and software engineers to develop robust data pipelines and machine learning models. Preferred candidate profile 5 years of hands-on experience with advanced SQL d…",https://www.adzuna.in/details/5742844383?utm_medium=api&utm_source=7cd92d92
5762095593,"Business Analyst II, ISFX",Amazon,"Hyderabad, Telangana",IT Jobs,,,2026-06-13T10:29:06Z,"Description We are looking for a customer-obsessed innovator, comfortable with ambiguity, with strong attention to detail, an ability to work in a fast-paced and ever-changing environment, and an ability to work effectively in cross-functional teams. They will have excellent oral and written communication skills, a focus to meet tight deadlines, multi-task, and prioritize work. Business Analyst will own the production and delivery of a suite of reports, dashboards and tools used by leaders to t…",https://www.adzuna.in/details/5762095593?utm_medium=api&utm_source=7cd92d92
5761955909,Informatica Developer,LTM,"Hyderabad, Telangana",IT Jobs,,,2026-06-13T08:55:01Z,"we expect a strong hands-on Informatica ETL developer with deep SCD and data warehousing concepts, strong SQL (very critical) optimization skills, basic Unix knowledge, clear real-time implementation expertise, along with Oracle/Informatica experience and exposure to CI/CD practices. Roles and Responsibilities Collaborate with data architect's analysts and business stakeholders to gather requirements and translate them into technical solutions. Monitors troubleshoot and resolve production issue…",https://www.adzuna.in/details/5761955909?utm_medium=api&utm_source=7cd92d92
5745231699,"Product Manager, R&D Data Catalyst Team",Amgen,"Hyderabad, Telangana",IT Jobs,,,2026-05-30T10:12:26Z,"The Product Manager for the R&D Data Catalyst Team is responsible for defining and specifying features for several technology products supporting R&D Precision medicine. These products are principally Data Management and Knowledge Management tools that provide the Amgen scientific community with visibility to Amgen's wealth of human datasets, projects and study histories, and knowledge over various scientific findings. These are not transactional solutions but rather visibility solutions that a…",https://www.adzuna.in/details/5745231699?utm_medium=api&utm_source=7cd92d92
5779486314,"Data Engineer (Snowflake, DBT/Matillion), Ahmedabad/ Hyderabad",AALUCKS Talent Pro,"Hyderabad, Telangana",IT Jobs,,,2026-06-28T02:45:11Z,"Position: Data Engineer (Snowflake, DBT/ Matillion), Ahmedabad / Hyderabad Department: Information Technology | Role: Full-time | Experience: 3 to 5 Years | Number of Positions: 2 | Location: Ahmedabad / Hyderabad Skillset: Snowflake, DBT/Matillion, Azure Cloud, Data Factory, Data Bricks, Data Warehousing, SQL, ETL/ELT, SSIS, Cloud Storage, Excellent English communication skills Job Description: About Us We provide companies with innovative technology solutions for everyday business problems. O…",https://www.adzuna.in/details/5779486314?utm_medium=api&utm_source=7cd92d92
5722397217,Ab Initio admin,Infosys Limited,"Hyderabad, Telangana",IT Jobs,,,2026-05-08T07:13:02Z,"Description We are seeking an experienced Ab Initio Admin to join our team in India. The ideal candidate will have a strong background in managing and optimizing Ab Initio environments, ensuring high performance and reliability. Responsibilities Manage and maintain Ab Initio environments and ensure optimal performance. Install, configure, and upgrade Ab Initio software as needed. Develop, test, and deploy ETL processes using Ab Initio tools. Monitor system performance and troubleshoot issues re…",https://www.adzuna.in/details/5722397217?utm_medium=api&utm_source=7cd92d92
5779827789,"Business Analyst I, EU INTech",Amazon,"Hyderabad, Telangana",IT Jobs,,,2026-06-28T10:29:08Z,"Description At Amazon, we strive to be the most innovative and customer centric company on the planet. Come work with us to develop innovative products, tools and research driven solutions in a fast-paced environment by collaborating with smart and passionate leaders, program managers and software developers. This role is based out of our Hyderabad corporate office and is for an passionate, dynamic, analytical, innovative, hands-on, and customer-obsessed Business analyst. Key job responsibiliti…",https://www.adzuna.in/details/5779827789?utm_medium=api&utm_source=7cd92d92
5713884188,User Success Leader,In Touch,"Hyderabad, Telangana",IT Jobs,,,2026-04-30T02:13:21Z,"About the Job We are seeking a dynamic, client-facing User Success Leader to drive adoption, engagement, and business value for our Prism platform—an AI-powered CX intelligence and analytics solution. This role sits at the center of client relationships, Insight delivery and storytelling, and product adoption and expansion. The User Success Leader will act as the bridge between data, insights, and client impact, ensuring our partners not only understand Prism outputs but confidently act on them…",https://www.adzuna.in/details/5713884188?utm_medium=api&utm_source=7cd92d92
5786652686,Data Engineer-Senior I,FedEx AMEA,"Hyderabad, Telangana",IT Jobs,,,2026-07-03T15:01:50Z,"Responsible for developing, optimize, and maintaining business intelligence and data warehouse systems, ensuring secure, efficient data storage and retrieval, enabling self-service data exploration, and supporting stakeholders with insightful reporting and analysis. Experience: 5–8 Years Location: Hyderabad, India (In‑office) Design, develop, and maintain scalable batch and near‑real‑time data pipelines on Google Cloud Platform (GCP). Build and manage ETL/ELT workflows using Cloud Composer (Air…",https://www.adzuna.in/details/5786652686?utm_medium=api&utm_source=7cd92d92
5743777089,"Product Manager, R&D Data Catalyst Team",Amgen,"Hyderabad, Telangana",IT Jobs,,,2026-05-29T02:08:17Z,"Career Category Information Systems Job Description The Product Manager for the R&D Data Ca talyst Team is res ponsible for defining and specifying features for several technology products supporting R&D Precision medicine. These products are principally Data Management and Knowledge Management tools that provide the Amgen scientific community with visibility to Amgen’s wealth of human datasets, projects and study histories, and knowledge over various scientific findings. These are not transact…",https://www.adzuna.in/details/5743777089?utm_medium=api&utm_source=7cd92d92
5768785530,Sr. Specialist-Data Visualization,Sanofi,"Hyderabad, Telangana",IT Jobs,,,2026-06-19T07:19:44Z,"Job title: Sr. Specialist - Data Visualization Location: Hyderabad About the job Sanofi is a global life sciences company committed to improving access to healthcare and supporting the people we serve throughout the continuum of care. From prevention to treatment, Sanofi transforms scientific innovation into healthcare solutions, in human vaccines, rare diseases, multiple sclerosis, oncology, immunology, infectious diseases, diabetes and cardiovascular solutions. As a company with a global visi…",https://www.adzuna.in/details/5768785530?utm_medium=api&utm_source=7cd92d92
5784346112,"Senior Analyst, Observational Health Data Analytics, Epidemiology - Hyderabad",Johnson & Johnson,"Hyderabad, Telangana",Scientific & QA Jobs,,,2026-07-02T02:49:30Z,"At Johnson & Johnson, we believe health is everything. Our strength in healthcare innovation empowers us to build a world where complex diseases are prevented, treated, and cured, where treatments are smarter and less invasive, and solutions are personal. Through our expertise in Innovative Medicine and MedTech, we are uniquely positioned to innovate across the full spectrum of healthcare solutions today to deliver the breakthroughs of tomorrow, and profoundly impact health for humanity. Learn …",https://www.adzuna.in/details/5784346112?utm_medium=api&utm_source=7cd92d92
5784974176,"Senior Analyst, Observational Health Data Analytics, Epidemiology - Hyderabad",J&J Family of Companies,"Hyderabad, Telangana",Scientific & QA Jobs,,,2026-07-02T10:33:27Z,"At Johnson & Johnson,?we believe health is everything. Our strength in healthcare innovation empowers us to build a?world where complex diseases are prevented, treated, and cured,?where treatments are smarter and less invasive, and?solutions are personal.?Through our expertise in Innovative Medicine and MedTech, we are uniquely positioned to innovate across the full spectrum of healthcare solutions today to deliver the breakthroughs of tomorrow, and profoundly impact health for humanity.?Learn …",https://www.adzuna.in/details/5784974176?utm_medium=api&utm_source=7cd92d92
5675512213,Data Platform Management,Amgen,"Hyderabad, Telangana",IT Jobs,,,2026-03-23T01:54:23Z,"Career Category Supply Chain Job Description Join Amgen’s Mission of Serving Patients At Amgen, if you feel like you’re part of something bigger, it’s because you are. Our shared mission—to serve patients living with serious illnesses—drives all that we do. Since 1980, we’ve helped pioneer the world of biotech in our fight against the world’s toughest diseases. With our focus on four therapeutic areas –Oncology, Inflammation, General Medicine, and Rare Disease– we reach millions of patients eac…",https://www.adzuna.in/details/5675512213?utm_medium=api&utm_source=7cd92d92
5755107932,"Senior Associate, Data Analytics Supply Chain",Amgen,"Hyderabad, Telangana",Accounting & Finance Jobs,,,2026-06-07T10:17:07Z,"Senior Associate, Data Analytics Supply Chain (Amgen External Planning) Live What you will do Let's do this! Let's change the world! In this vital role you will be part of the External Planning and Delivery Team, which is responsible for strategy and execution of all aspects of supply chain supporting our external manufacturing network. The Senior Associate Amgen External Planning (AXP) reports to the Business Performance Manager of Supply Planning at the Amgen India, Hyderabad site. In this ro…",https://www.adzuna.in/details/5755107932?utm_medium=api&utm_source=7cd92d92
5753538142,"Senior Associate, Data Analytics Supply Chain",Amgen,"Hyderabad, Telangana",Accounting & Finance Jobs,,,2026-06-06T02:18:28Z,"Career Category Supply Chain Job Description Senior Associate, Data Analytics Supply Chain (Amgen External Planning) Live What you will do Let’s do this! Let’s change the world! In this vital role you will be part of the External Planning and Delivery Team, which is responsible for strategy and execution of all aspects of supply chain supporting our external manufacturing network. The Senior Associate Amgen External Planning (AXP) reports to the Business Performance Manager of Supply Planning a…",https://www.adzuna.in/details/5753538142?utm_medium=api&utm_source=7cd92d92
5788382674,Analyst II (R-19559),Dun & Bradstreet,"Hyderabad, Telangana",IT Jobs,,,2026-07-05T03:33:52Z,"Shape the Future with Dun & Bradstreet At Dun & Bradstreet, we believe data has the power to create a better tomorrow. As a global leader in business decisioning data and analytics, we help companies worldwide grow, manage risk, and innovate. For over 180 years, businesses have trusted us to turn uncertainty into opportunity. We’re a diverse, global team that values creativity, collaboration, and bold ideas. Are you ready to make an impact and help shape what’s next? Join us! Explore opportunit…",https://www.adzuna.in/details/5788382674?utm_medium=api&utm_source=7cd92d92
5768785062,Lead Consultant I,Metlife,"Hyderabad, Telangana",IT Jobs,,,2026-06-19T07:19:36Z,"Description and Requirements Profile Summary : The Software/Platform Engineer will play a crucial role in development and maintenance of software development solutions within a defined system, platform or product, based on a set of standards and processes which establish consistency acrost the enterprise data, reduce risk and promote efficiencies in support of the organization's goals and objectives. The engineer will work closely with cross-functional teams to deliver high-quality, scalable, a…",https://www.adzuna.in/details/5768785062?utm_medium=api&utm_source=7cd92d92
4581897980,Data Analytics and Engineering Leader,Carrier,"Hyderabad, Telangana",Engineering Jobs,,,2024-02-25T21:08:25Z,"Country: India Location: Building No 12D, Floor 5, Raheja Mindspace, Cyberabad, Madhapur, Hyderabad - 500081, Telangana, India Job Title – Data Analytics and Engineering Leader Preferred Location - Bangalore, India Full time/Part Time - Full Time Build a career with confidence Carrier is a leading provider of heating, ventilating, air conditioning and refrigeration systems, building controls and automation, and fire and security systems leading to safer, smarter, sustainable, and high-performan…",https://www.adzuna.in/details/4581897980?utm_medium=api&utm_source=7cd92d92
5713084196,"Data Engineer -analytics & Transformation (dbt, Aws Cloud)",CGI,"Hyderabad, Telangana",IT Jobs,,,2026-04-29T05:42:39Z,"Job Description Role & responsibilities Build and maintain efficient and scalable data pipelines and ETL processes. Design, develop, and maintain dbt models to transform raw data into analyticsready datasets using modular, versioncontrolled workflows. Manage and organize structured and unstructured data stored in AWS S3 (link removed) Implement data quality checks, governance, and performance monitoring (link removed) Collaborate with data scientists, analysts, and business teams to deliver rel…",https://www.adzuna.in/details/5713084196?utm_medium=api&utm_source=7cd92d92
