id,title,company,location,category,salary_min,salary_max,created,description,redirect_url
2566774995,Business Analyst,Growisto,"Mumbai, Maharashtra",IT Jobs,700000.0,1200000.0,2021-10-22T05:05:11Z,"About Us: We are a group of techies, data analysts, digital marketers, and operations professionals who have come together to provide next-generation e-commerce solutions. We help brands & private labels to grow their businesses on platforms such as Amazon and their own website. We love brainstorming ideas on marketing businesses through digital media and utilize technology to execute them further to achieve the desired goals. Current Offerings of Technology Department: Creating scalable and co…",https://www.adzuna.in/details/2566774995?utm_medium=api&utm_source=7cd92d92
2171039989,Full-stack Developer,Qrata,"Mumbai, Maharashtra",IT Jobs,1500000.0,2300000.0,2021-05-08T11:50:51Z,"About the company Qrata is hiring for the company which provides business tools for thecreators to set up paid communities by providing one time and subscription based services. Quick Facts Founded in: 2019 Number of Employees: 11 - 50 Employees Industry: Marketing & Advertising Headquarters: Mumbai Technology Stack: MongoDB, Express, React, Node Full-stack Developer - Job Skills & Responsibilities Work with development teams and product managers to ideate software solutions Design client-side …",https://www.adzuna.in/details/2171039989?utm_medium=api&utm_source=7cd92d92
2953661299,Sales Manager,Growisto,"Mumbai, Maharashtra",Sales Jobs,700000.0,1500000.0,2022-03-08T05:06:25Z,"About Us: We are a group of 110 techies, data analysts, digital marketers, and operations professionals who have come together to provide next-generation e-commerce solutions. We help brands & private labels to grow their businesses by providing them a scalable and conversion-friendly e-commerce platform using Magento. We love brainstorming ideas on how businesses can utilize technology to achieve their desired goals. Growisto has expertise of providing the below services: 1)Amazon Marketing : …",https://www.adzuna.in/details/2953661299?utm_medium=api&utm_source=7cd92d92
5785773086,APAC CLM (Client Lifecycle Management) - Associate,Deutsche Bank,"Mumbai, Maharashtra",IT Jobs,,,2026-07-03T00:54:32Z,"This job is with Deutsche Bank, an inclusive employer and a member of myGwork – the largest global platform for the LGBTQ business community. Please do not contact the recruiter directly. Position Overview Role Description We are looking for an energetic and self-driven expert with passion for data management and with strong analytical capabilities. The candidate must have the ability to think out of the box, can work independently, and take accountability. As a Business MI Analyst, the candida…",https://www.adzuna.in/details/5785773086?utm_medium=api&utm_source=7cd92d92
5691860343,Data Engineer,Adsremedy Media LLP,"Mumbai, Maharashtra",IT Jobs,300000.0,1000000.0,2026-04-07T11:44:38Z,"About the Role: We are seeking a skilled Data Engineer to join our growing AdTech team. In this role, you will design, build, and maintain high-performance ETL pipelines and large-scale data processing systems. You will work with massive datasets and distributed frameworks to power Adsremedy’s data-driven advertising solutions across Programmatic, In-App, CTV, and DOOH platforms. What You’ll Do: Design, develop, and maintain scalable ETL pipelines on self-managed infrastructure Process and opti…",https://www.adzuna.in/details/5691860343?utm_medium=api&utm_source=7cd92d92
5756755747,"Team Lead, Analytical Data Support",Morningstar,"Mumbai, Maharashtra",IT Jobs,,,2026-06-09T06:51:54Z,"Morningstar DBRS is seeking a Data Team Lead to join the Credit Operations Mumbai Analytics. The Data Team Lead is part of the team responsible for maintaining critical ratings and origination data. In this role, as part of your role you will support analytical teams and initiatives, process transition, automation, and technology innovation. You will assist in project and operations management wherever Mumbai is centrally involved. Responsibilities: Lead a team of Data Research analysts who are…",https://www.adzuna.in/details/5756755747?utm_medium=api&utm_source=7cd92d92
5759286295,Data Engineer,Godrej Properties,"Mumbai, Maharashtra",IT Jobs,,,2026-06-11T06:52:26Z,"Job Responsibilities: Data Pipeline Development : Design, develop, and optimize data pipelines to ingest, process, and transform data from various sources (e.g., APIs, databases, into the data warehouse. Data Integration: Integrate data from various structured and unstructured sources into the Databricks Lakehouse environment, ensuring data accuracy and reliability Data Lakehouse storage Management: Design and maintain data warehouse solutions using medallion architecture practices, optimizing …",https://www.adzuna.in/details/5759286295?utm_medium=api&utm_source=7cd92d92
5784727704,Data Engineer,Godrej Foods,"Mumbai, Maharashtra",IT Jobs,,,2026-07-02T07:17:00Z,"Data Pipeline Development : Design, develop, and optimize data pipelines to ingest, process, and transform data from various sources (e.g., APIs, databases, into the data warehouse. Data Integration: Integrate data from various structured and unstructured sources into the Databricks Lakehouse environment, ensuring data accuracy and reliability Data Lakehouse storage Management: Design and maintain data warehouse solutions using medallion architecture practices, optimizing storage, cloud utiliza…",https://www.adzuna.in/details/5784727704?utm_medium=api&utm_source=7cd92d92
5756755689,Associate Language Specialist,Morningstar,"Mumbai, Maharashtra",Accounting & Finance Jobs,,,2026-06-09T06:51:48Z,"Title : Associate Korean Language Specialist Shift : General The Team : The PitchBook team performs web-based research for private capital markets and also Stock exchange filings for research on public companies. PitchBook's Public Equity Data teams collect, analyze, and maintain comprehensive datasets covering Financial statements, Capital structures, Industry & Normalized Metrics, and Documents Sourcing, Executive insights, Estimates, Transcripts, etc. These teams leverage advanced tools and …",https://www.adzuna.in/details/5756755689?utm_medium=api&utm_source=7cd92d92
5397768879,Executive - Performance Metrics & Analytics,Essar Global Fund,"Mumbai, Maharashtra",IT Jobs,,,2025-09-13T23:30:46Z,"Description Job Title: Executive– Performance Metrics & Analytics Location: Manjari, Pune Department: Operations Key Responsibilities Design, develop, and maintain daily/weekly/monthly MIS reports for operations, finance, sales, and supply chain teams. Automate data processes and report generation using advanced Excel functions, macros, and/or scripts. Prepare dashboards for tracking KPIs such as order fulfillment, inventory movement, vendor performance, and sales trends. Coordinate with cross-…",https://www.adzuna.in/details/5397768879?utm_medium=api&utm_source=7cd92d92
5779828203,OneStream Developer - Officer,Citigroup,"Mumbai, Maharashtra",Accounting & Finance Jobs,,,2026-06-28T10:29:50Z,"Citi Finance is responsible for the firm's financial management and related controls. We manage and partner on key Citi initiatives and deliverables, such as our quarterly earnings process and ensuring Citi's compliance with financial rules and regulations. The team comprises chief financial officers who partner with each of our businesses and disciplines including controllers, strategy, investor relations, tax and treasury. We're currently looking for a high caliber professional to join our te…",https://www.adzuna.in/details/5779828203?utm_medium=api&utm_source=7cd92d92
2102778160,Sr. Data Engineer,Magic9 Media and Consumer Knowledge Pvt. Ltd.,"Mumbai, Maharashtra",IT Jobs,700000.0,1200000.0,2021-04-07T05:28:45Z,Job Description This requirement is to service our client which is a leading big data technology company that measures what viewers consume across platforms to enable marketers make better advertising decisions. We are seeking a Senior Data Operations Analyst to mine large-scale datasets for our client. Their work will have a direct impact on driving business strategies for prominent industry leaders. Self-motivation and strong communication skills are both must-haves. Ability to work in a fast…,https://www.adzuna.in/details/2102778160?utm_medium=api&utm_source=7cd92d92
5555404686,Senior Software Engineer,Morningstar,"Mumbai, Maharashtra",IT Jobs,,,2025-12-26T00:31:19Z,"Location: Mumbai Reports to: Tech Team Lead About the Role We are looking for a Software Developer/Data Scientist to join our Data Services team, specializing in delivering custom client-ready reports and managing data corrections. This role requires strong technical skills in Python, SQL, and Excel, combined with experience in AWS cloud services such as Athena and Aurora. You will play a key role in ensuring clients receive high-quality, tailored data outputs and that corrections are handled e…",https://www.adzuna.in/details/5555404686?utm_medium=api&utm_source=7cd92d92
5756755679,Sr. Product Designer,Morningstar,"Mumbai, Maharashtra",IT Jobs,,,2026-06-09T06:51:47Z,"About the Role As a member of the Product and Engineering team at PitchBook, you will be part of a team of big thinkers, innovators, and problem solvers who strive to deepen the positive impact we have on our customers and our company every day. We value curiosity and the drive to find better ways of doing things. We thrive on customer empathy, which remains our focus when creating excellent customer experiences through product innovation. As a Senior Product Designer, you will be responsible f…",https://www.adzuna.in/details/5756755679?utm_medium=api&utm_source=7cd92d92
5785772483,Associate Digital Media Manager,Reckitt,"Mumbai, Maharashtra","PR, Advertising & Marketing Jobs",,,2026-07-03T00:54:27Z,"This job is with Reckitt, an inclusive employer and a member of myGwork – the largest global platform for the LGBTQ business community. Please do not contact the recruiter directly. We are Reckitt Home to the world's best loved and trusted hygiene, health, and nutrition brands. Our purpose defines why we exist: to protect, heal and nurture in the relentless pursuit of a cleaner, healthier world. We are a global team united by this purpose.Join us in our fight to make access to the highest quali…",https://www.adzuna.in/details/5785772483?utm_medium=api&utm_source=7cd92d92
5759553047,Solution Architect - Power BI Migration,Kyndryl,"Mumbai, Maharashtra",IT Jobs,,,2026-06-11T10:22:48Z,"Who We Are At Kyndryl, we run and reimagine the mission-critical technology systems that drive advantage for the world's leading businesses. We are at the heart of progress; with proven expertise and a continuous flow of AI-powered insight, enabling smarter decisions, faster innovation, and a lasting competitive edge. For our people-Kyndryls-that means doing purposeful work that powers human progress. Join us and experience a flexible, supportive environment where your well-being is prioritized…",https://www.adzuna.in/details/5759553047?utm_medium=api&utm_source=7cd92d92
5738418796,Sanctions Compliance Associate,TIAA,"Mumbai, Maharashtra",IT Jobs,,,2026-05-23T10:17:41Z,"Compliance Sr Associate - IN We are seeking a seasoned BSA/AML Compliance Data Analyst with a strong blend of financial crime domain expertise and advanced data analytics capabilities. The ideal candidate will bring 3 years of dedicated BSA/AML compliance experience within an overall 5 years of professional work history. In this role, you will sit at the intersection of compliance and technology, designing and deploying data-driven solutions that strengthen our AML and Fraud detection framework…",https://www.adzuna.in/details/5738418796?utm_medium=api&utm_source=7cd92d92
5769829944,Junior Data Scientist,Datamatics Technologies,"Mumbai, Maharashtra",IT Jobs,,,2026-06-20T03:32:18Z,"Job Title: Junior Data Scientist / Forecasting Analyst Location: Offshore – India Engagement Type: Contract (4 Months, Extendable) Start Date: 1st July 2026 Experience Required: 3–4 Years Overall Experience Relevant Experience: Minimum 1.5 Years in Data Science, Machine Learning, or Predictive Analytics About the Role We are seeking a motivated and detail-oriented Junior Data Scientist / Forecasting Analyst to support our Data Science team in the development, execution, and maintenance of predi…",https://www.adzuna.in/details/5769829944?utm_medium=api&utm_source=7cd92d92
5785771281,Senior Software Engineer,Morningstar,"Mumbai, Maharashtra",IT Jobs,,,2026-07-03T00:54:14Z,"This job is with Morningstar, an inclusive employer and a member of myGwork – the largest global platform for the LGBTQ business community. Please do not contact the recruiter directly. Location: Mumbai Reports to: Tech Team Lead About the Role We are looking for a Software Developer/Data Scientist to join our Data Services team, specializing in delivering custom client-ready reports and managing data corrections. This role requires strong technical skills in Python, SQL, and Excel, combined wi…",https://www.adzuna.in/details/5785771281?utm_medium=api&utm_source=7cd92d92
4207419379,Fullstack Developer,Spinnakar Analytics,"Mumbai, Maharashtra",IT Jobs,450000.0,750000.0,2023-07-15T14:48:13Z,"Description We are looking for a Full Stack Developer to produce scalable software solutions. You’ll be part of a cross-functional team that’s responsible for the full software development life cycle, from conception to deployment. As a Full Stack Developer, you should be comfortable around both front-end and back-end coding languages, development frameworks and third-party libraries. You should also be a team player with a knack for visual design and utility. If you’re also familiar with Agile…",https://www.adzuna.in/details/4207419379?utm_medium=api&utm_source=7cd92d92
3129682591,AVP Analytics,liquiloans,"Mumbai, Maharashtra",Accounting & Finance Jobs,2000000.0,2500000.0,2022-05-13T05:26:52Z,"Role: AVP Analytics The AVP Analytics will have the following responsibilities: • Analyze data across all verticals in the organization to come up with actionable insights and recommendations • Conceptualize and define key metrics to track for all functions within the organization • Create strategic roadmap and business cases to enter into new products/lines of business • Build, develop and maintain dashboards and performance metrics support that support key business decisions. • Lead cross-fun…",https://www.adzuna.in/details/3129682591?utm_medium=api&utm_source=7cd92d92
5750081650,Data Engineer (Power BI & Snowflake),r3 Consultant,"Mumbai, Maharashtra",IT Jobs,1500000.0,1700000.0,2026-06-03T09:42:44Z,"Job Title: Data Engineer with Power BI and Snowflake Location- Andheri, Mumbai Work Mode- Work from Office (5 Days a Week) Notice Period- Immediate Joiners Only Experience- 3 – 5 Years Budget- Up to 15 – 17 LPA Job Summary We are looking for a highly skilled Snowflake Developer with strong Power BI expertise to join our growing data and analytics team. The ideal candidate will have hands-on experience in data warehousing, dimensional modeling, Snowflake development, SQL optimization, and Power …",https://www.adzuna.in/details/5750081650?utm_medium=api&utm_source=7cd92d92
3409849796,Full Stack Software Developer,Archcorp Architectural Engineering,"Mumbai, Maharashtra",IT Jobs,400000.0,1000000.0,2022-08-17T06:38:47Z,"Main Responsibilities: Observe, strategize, develop and design required software solutions. Designing Client-Side and Server-Side Architecture and Rendering and Static Site Generation. To confer with users - by studying systems flow, data usage & work related bottlenecks. Design and implement Back End and Front End code Interact with the production team, understand their workflow and find new ways to automate their workflow. Write effective APIs as well as Integrate third-party APIs. Test softw…",https://www.adzuna.in/details/3409849796?utm_medium=api&utm_source=7cd92d92
5676251268,IN-Sr Associate_GCP Data Engnr_Data & Analytics_Advisory_Mum,PricewaterhouseCoopers,"Goregaon East, Mumbai",IT Jobs,,,2026-03-24T01:50:08Z,"Line of Service Advisory Industry/Sector Not Applicable Specialism Data, Analytics & AI Management Level Senior Associate Job Description & Summary At PwC, our people in data and analytics engineering focus on leveraging advanced technologies and techniques to design and develop robust data solutions for clients. They play a crucial role in transforming raw data into actionable insights, enabling informed decision-making and driving business growth. In data engineering at PwC, you will focus on…",https://www.adzuna.in/details/5676251268?utm_medium=api&utm_source=7cd92d92
5787430975,Finance/Investment Analyst-Intern,Kodo,"Mumbai, Maharashtra",Accounting & Finance Jobs,180000.0,240000.0,2026-07-04T06:28:50Z,"About the Role We are looking for a highly analytical and business-oriented Analyst to join our team. This role sits at the intersection of finance, economics, treasury, and data science. You will be responsible for building predictive models that drive treasury decisions, cash flow forecasting, macroeconomic analysis, and investment recommendations. This is an opportunity to work on financial products where data-driven insights directly influence business outcomes. The ideal candidate is passi…",https://www.adzuna.in/details/5787430975?utm_medium=api&utm_source=7cd92d92
5443987205,Lead - Financial Planning & Analysis| Mumbai,CSB Bank,"Mumbai, Maharashtra",Accounting & Finance Jobs,,,2025-10-12T14:44:56Z,Description Act as Finance Partner to Business/Product Stakeholders. Active participation in all New product lauches to provide accounting as well as Financial planning support. Prepare monthly/Yearly Business Plans and track financial performance against the targets. Analyse various KPI’s for various products and highlight areas of improvement to the business teams Responsibilities Planning and Budgetting for each of the businesses and Products in Retail/ SME/Wholesale/Financial Markets. Month…,https://www.adzuna.in/details/5443987205?utm_medium=api&utm_source=7cd92d92
3409849752,Front-End Software Developer,Archcorp Architectural Engineering,"Mumbai, Maharashtra",IT Jobs,400000.0,1000000.0,2022-08-17T06:38:46Z,"Main Responsibilities: Observe, strategize, develop and design user-friendly UI/UX using markup languages like HTML. Designing Client-Side and Server-Side Architecture and Rendering and Static Site Generation. To confer with users - by studying systems flow, data usage & work related bottlenecks. Design and implement Front-End code Interact with the production team, understand their workflow and find new ways to visualize their workflows on web apps. Integrating Python Scripts with Python-based…",https://www.adzuna.in/details/3409849752?utm_medium=api&utm_source=7cd92d92
5772985231,Analyst- Customer Service Operations,Experian,"Mumbai, Maharashtra",IT Jobs,,,2026-06-23T05:55:06Z,"Job Description Job description Role Title: Data Correction / OLM Process Associate (or Analyst) Function: Customer Experience / Operations / Data Governance Reports To: Team Lead – Data Correction / Customer Operations Role Purpose To ensure accurate, secure, and compliant processing of customer data correction requests across systems, in line with regulatory requirements, internal policies, and risk controls. The role is critical in maintaining data integrity, reducing customer complaints, an…",https://www.adzuna.in/details/5772985231?utm_medium=api&utm_source=7cd92d92
2383302553,Machine Learning Engineer,SIlverPeople Consulting,"Mumbai, Maharashtra",IT Jobs,0.0,2700000.0,2021-08-14T21:16:57Z,"ML Engineer-Analyst/ Senior Analyst Job purpose: To design and develop machine learning and deep learning systems. Run machine learning tests andexperiments and implementing appropriate ML algorithms. Works cross-functionally with the Data Scientists, Software application developers and business groups for the development of innovative ML models. Use Agile experience to work collaboratively with other Managers/Owners in geographically distributed teams. Accountabilities: Work with Data Scientis…",https://www.adzuna.in/details/2383302553?utm_medium=api&utm_source=7cd92d92
5708801776,Sr. Automation Engineer Software Engineer,Reliance Industries Limited,"Mumbai, Maharashtra",IT Jobs,,,2026-04-24T05:39:24Z,Job Role ID ( Ex.47009422) Job Role Text Sr. Software Engineer Full Stack Developer Sub-Functional Area ID (Ex. 47031054) Sub-Functional Area Text R&D Functional Area ID (Ex. 47046007) Functional Area Text R&D Engineer Technology Process Automation Job Grade I Short Text (Maximum 400 characters) Full stack software developer practising Agile methodologies to produce scalable software solutions. Software professional responsible for working on both front-end and back-end development processes. D…,https://www.adzuna.in/details/5708801776?utm_medium=api&utm_source=7cd92d92
5731961143,Data Engineer,Ion,"Mumbai, Maharashtra",IT Jobs,,,2026-05-17T06:47:17Z,"Key responsibilities: Analyze, parse and clean large datasets of structured and unstructured data Collaborate closely with security analysts and lead developers to understand bottlenecks and to prioritize, correct and ingest cleaned data Develop data ingestion frameworks to handle high-volume and high-variety data, including structured and unstructured data recovered from 2000 data sources across the deep, dark and open web Implement data quality control measures to detect and handle data anoma…",https://www.adzuna.in/details/5731961143?utm_medium=api&utm_source=7cd92d92
5731961174,Data Engineer,Ion,"Mumbai, Maharashtra",IT Jobs,,,2026-05-17T06:47:18Z,"Key responsibilities: Analyze, parse and clean large datasets of structured and unstructured data Collaborate closely with security analysts and lead developers to understand bottlenecks and to prioritize, correct and ingest cleaned data Develop data ingestion frameworks to handle high-volume and high-variety data, including structured and unstructured data recovered from 2000 data sources across the deep, dark and open web Implement data quality control measures to detect and handle data anoma…",https://www.adzuna.in/details/5731961174?utm_medium=api&utm_source=7cd92d92
5040652545,Data QA Specialist,YipitData,"Mumbai, Maharashtra",Accounting & Finance Jobs,,,2025-02-07T11:21:48Z,"About Us: YipitData is the market-leading data and analytics firm. We analyze billions of data points every day to provide accurate, detailed insights across industries, including consumer brands, technology, software, and healthcare. Our insights team uses proprietary technology to identify, license, clean, and analyze the data that many of the worlds largest investment funds and corporations depend on. We raised $475M from The Carlyle Group at a valuation over $1B, further accelerating our gr…",https://www.adzuna.in/details/5040652545?utm_medium=api&utm_source=7cd92d92
2509165170,Data Warehouse Architect,The Hub,"Mumbai, Maharashtra",IT Jobs,1000000.0,2300000.0,2021-10-02T04:35:42Z,• You will work alongside the Project Management to ensure alignment of plans with what is being delivered. • You will utilize your configuration management and software release experience; as well as change management concepts to drive the success of the projects. • You will partner with senior leaders to understand and communicate the business needs to translate them into IT requirements. Consult with Customer’s Business Analysts on their Data warehouse requirements • You will assist the tech…,https://www.adzuna.in/details/2509165170?utm_medium=api&utm_source=7cd92d92
5169680407,Product Analyst,Ketto,"Mumbai, Maharashtra",IT Jobs,1000000.0,1500000.0,2025-04-30T06:41:06Z,"About the company : Ketto is Asia's largest tech-enabled crowdfunding platform with a vision - Healthcare for all. We are a profit-making organization with a valuation of more than 100 Million USD. With over 1,100 crores raised from more than 60 lakh donors, we have positively impacted the lives of 2 lakh campaigners. Ketto has embarked on a high-growth journey, and we would like you to be part of our family, helping us to create a large-scale impact on a daily basis by taking our product to th…",https://www.adzuna.in/details/5169680407?utm_medium=api&utm_source=7cd92d92
5728384553,TechnoFunctional SME (Business Analyst),Mancraft Consulting,"Mumbai, Maharashtra",IT Jobs,,,2026-05-14T02:22:54Z,"Job Description: Job Title: Business Analyst (Finance & Data Engineering) Job Summary: We are seeking an experienced Business Analyst with a strong background in Finance and Accounting, coupled with expertise in data design, data engineering, and data visualization. The ideal candidate will be responsible for analyzing financial data, understanding business requirements, designing data flow, and rendering insights into Power BI dashboards. The role requires collaboration with cross-functional t…",https://www.adzuna.in/details/5728384553?utm_medium=api&utm_source=7cd92d92
5727253840,Business Analyst - Corporate and SME - Leading Bank,Acura Solution,"Mumbai, Maharashtra",IT Jobs,,,2026-05-13T02:14:44Z,"Job Description: 1. Requirements Gathering: The Business Analyst is responsible for gathering and documenting business and user requirements for business solutions, including functional and non-functional requirements. 2. Requirements Analysis: The Business Analyst is responsible for analyzing requirements to identify potential issues, gaps, and opportunities for improvement, and ensuring that requirements are complete, accurate, and feasible. 3. Design: The Business Analyst is responsible for …",https://www.adzuna.in/details/5727253840?utm_medium=api&utm_source=7cd92d92
